{
  "opera_riferimento": {
    "titolo": "I quaranta giorni del Mussa Dagh",
    "autore": "Franz Werfel"
  },
  "assi_implicati": [
    {
      "axis_id": "asse_1",
      "axis_name": "Ontologico–fenomenologico",
      "grado_implicazione": "alto",
      "motivazione": "L'opera è in larga misura il racconto della costituzione di un soggetto collettivo che si dà una forma piena di esistenza nel tempo, nel corpo e nella relazione. Sulla montagna la comunità non si limita a sopravvivere: ordina il proprio campo intenzionale (consiglio dei capi, trincee, ospedale da campo, scuola, funzioni religiose), si temporalizza per quaranta giorni in un presente denso di ritenzione (le tradizioni, la memoria armena) e protensione (l'attesa del soccorso, l'anticipazione dell'attacco), si regola attraverso co-regolazione (assemblee, riti, milizia) prima ancora che attraverso qualsiasi normatività esplicita. Parallelamente, la parabola di Gabriel Bagradian incarna l'ipseità dinamica: lo stesso soggetto resta sé attraverso una trasformazione profonda — non malgrado, ma attraverso il ritorno catastrofico al villaggio natale. La vulnerabilità strutturale degli assediati (esposizione, fame, dipendenza dall'altro per sopravvivere) non è descritta come deficit da superare ma come la condizione stessa in cui può darsi una soggettività comunitaria.",
      "nodi_attivati_in_questo_asse": [
        "soggetto-come-processo",
        "temporalità-vissuta",
        "corporeità-vissuta",
        "co-regolazione",
        "relazione-costitutiva",
        "campo-intenzionale",
        "vulnerabilità-strutturale",
        "ipseità-dinamica"
      ]
    },
    {
      "axis_id": "asse_2",
      "axis_name": "Affettivo–morale",
      "grado_implicazione": "medio",
      "motivazione": "L'asse è presente ma non dominante. La comunità del Musa Dagh funziona come istanza interna per i suoi membri: anche in assenza di sorveglianza visibile, il vincolo affettivo verso l'altro (i compagni, i morti, i bambini, i vecchi) opera come riferimento che vincola dall'interno. Si dà una forma di responsabilità affettiva pre-normativa: Gabriel risponde alla comunità non in forza di una legge universale ma di un legame che è diventato interiormente vincolante. Il processo a Sarkis Kilikian mostra la sopravvivenza dell'altro/comunità all'aggressività interna senza ritirare il legame. La morte di Stephan apre per Gabriel un'esperienza di colpa che oscilla tra forma integrativa (orientata a una sorta di riparazione impossibile, simbolizzata dalla veglia sulla tomba) e forma persecutoria (resto irrimediabile, condensato nella scelta finale di non imbarcarsi). L'asse, però, non occupa il cuore dell'opera: la trasformazione affettiva non è esplorata come genesi, ma assunta come già operante.",
      "nodi_attivati_in_questo_asse": [
        "interiorizzazione-dell-altro",
        "istanza-interna",
        "colpa-affettiva",
        "sopravvivenza-dell-oggetto",
        "responsabilità-pre-normativa",
        "aggressività-come-condizione"
      ]
    },
    {
      "axis_id": "asse_3",
      "axis_name": "Normativo–educativo",
      "grado_implicazione": "medio",
      "motivazione": "L'opera mette in scena un esperimento di normatività in condizioni di assedio. Il consiglio dei capi è il luogo del giudizio situato, irriducibile a procedura: davanti all'ordine di deportazione la comunità deve decidere, e nessuna regola precedente basta. Ter Haigasun e Gabriel incarnano due forme di autorità (spirituale-comunitaria e organizzativa) che non coincidono con dominio o violenza ma valgono solo nella misura in cui vengono riconosciute. Sarkis Kilikian opera come contro-campo radicale: la sua presenza impedisce la riduzione della normatività a moralismo. I capitoli di Lepsius proiettano la questione su scala internazionale: il fallimento normativo delle cancellerie europee, descritto attraverso telegrammi e dispacci, è un caso esemplare di collasso della normatività in pura procedura amministrativa. Il limite del giudizio è ovunque: di fronte al genocidio nessuna norma è sufficiente.",
      "nodi_attivati_in_questo_asse": [
        "distinzione-norma-normativita",
        "giudizio-situato",
        "autorità-educativa",
        "asimmetria-educativa",
        "responsabilità-come-imputazione",
        "fallimento-normativo",
        "limite-del-giudizio"
      ]
    },
    {
      "axis_id": "asse_4",
      "axis_name": "Separazione e Limite",
      "grado_implicazione": "alto",
      "motivazione": "L'opera è strutturata sull'incontro con il reale in tutte le sue forme — eccedenza, perdita, separazione. Il genocidio non è frustrazione regolabile né fallimento educativo: è limite reale nella forma estrema del 'non è possibile' imposto dallo Stato. L'eccedenza è quella della sproporzione fra una piccola comunità e l'apparato di sterminio dell'Impero. La perdita è ovunque, in forma irreversibile: la morte di Stephan, la fine prevedibile del mondo armeno della regione, il 'resto non simbolizzabile' che la veglia di Gabriel sulla tomba tenta di tenere senza neutralizzarlo. La separazione dall'onnipotenza è il tema implicito della parabola di Gabriel: l'intellettuale parigino che credeva di poter organizzare la sopravvivenza dei suoi, scopre — attraverso la morte del figlio e l'esaurimento delle scorte — che il desiderio non organizza il reale. La scelta finale di non imbarcarsi non è disperazione ma fedeltà a un reale che non può essere ricondotto a una nuova vita 'altrove'. La struttura tripartita del Libro terzo (Untergang – Rettung – Untergang) iscrive narrativamente proprio la coesistenza di salvezza e catastrofe.",
      "nodi_attivati_in_questo_asse": [
        "limite-reale",
        "eccedenza",
        "perdita",
        "irreversibilità",
        "separazione-dall-onnipotenza",
        "onnipotenza",
        "lavoro-del-lutto",
        "resto-non-simbolizzabile",
        "condizione-del-desiderio"
      ]
    },
    {
      "axis_id": "asse_5",
      "axis_name": "Desiderio",
      "grado_implicazione": "medio",
      "motivazione": "Il desiderio è presente come forma di orientamento collettivo che si dà nell'esperienza prima di qualsiasi deliberazione: la decisione di salire sul Musa Dagh non è il prodotto di una scelta razionale fra alternative equivalenti, ma il riconoscimento di una direzione del campo già carica di valore (continuare a esistere come popolo, non subire la deportazione). Il triangolo Gabriel-Juliette-Iskuhi articola il desiderio individuale come riorganizzazione del campo intenzionale dopo la perdita dell'identità parigina di Gabriel: il legame con Iskuhi non è compensazione del legame coniugale ma direzione che il campo assume nel mondo armeno ritrovato. Si dà inoltre un ordo amoris implicito: la comunità ordina ciò che vale (la dignità collettiva, la cura dei morti, la fede) rispetto a ciò che vale meno (la sopravvivenza individuale a ogni costo). L'asse, però, non è autonomamente protagonista: il desiderio è leggibile soprattutto nella relazione con il limite (Asse 4) e con la mediazione storica (Asse 6).",
      "nodi_attivati_in_questo_asse": [
        "desiderio-come-struttura",
        "mancanza-strutturale",
        "campo-desiderabile",
        "ordo-amoris",
        "direzione-valutativa"
      ]
    },
    {
      "axis_id": "asse_6",
      "axis_name": "Storico–culturale",
      "grado_implicazione": "alto",
      "motivazione": "L'asse è co-strutturante con l'Asse 4 nella configurazione complessiva dell'opera. Il romanzo descrive il genocidio armeno non come crimine episodico ma come dispositivo storico: ordini, telegrammi, decreti di sottoprefetti, comunicazioni dello stato maggiore costituiscono la mediazione attraverso cui la violenza di Stato entra nell'esperienza quotidiana dei villaggi. L'istituzione-come-dispositivo (qui: l'apparato del Comitato Unione e Progresso) organizza ciò che è possibile, visibile, pensabile per la popolazione armena, fino al punto di renderne possibile la cancellazione amministrativa. La storicità del soggetto è doppia: dei personaggi (Gabriel, parigino-armeno; Juliette, francese; Iskuhi, armena anatolica) e dell'opera stessa (Werfel, ebreo praghese, Vienna 1933, ascesa del nazionalsocialismo). I capitoli di Lepsius proiettano la questione sulla mediazione internazionale: cancellerie tedesche e ottomane, diplomazia, opinione pubblica europea. La deformazione strutturale è esplicita: lo Stato moderno come configurazione che produce sistematicamente la disumanizzazione di una popolazione attraverso burocrazia, tecnica e prestazione organizzativa. La 'tecnica come forma storica' assume qui il volto della macchina amministrativa dello sterminio, prefigurazione di quanto sarebbe accaduto in Europa dopo il 1933.",
      "nodi_attivati_in_questo_asse": [
        "mediazione-strutturale",
        "orizzonte-di-senso",
        "storicità-del-soggetto",
        "mediazione-simbolica",
        "istituzione-come-dispositivo",
        "lebenswelt",
        "tecnica-come-forma-storica",
        "deformazione-strutturale"
      ]
    }
  ],
  "nodi_trasversali_attivati": [
    {
      "nodo": "campo-intenzionale",
      "asse_di_appartenenza": "asse_1",
      "definizione_breve": "Struttura globale pre-riflessiva dell'esperienza; sintesi fenomenologica dell'organizzazione complessiva della soggettività.",
      "evidenza_nell_opera": "L'organizzazione dell'altipiano del Musa Dagh — trincee, depositi viveri, ospedale, assemblea, scuola — non è elenco di funzioni ma riorganizzazione complessiva dell'orizzonte del possibile per cinquemila persone. La comunità, decidendo di salire, riconfigura il proprio campo: ciò che era ovvio (il villaggio, la quotidianità) diventa impossibile; ciò che era impensabile (l'autogoverno armato) diventa l'orizzonte effettivo. Lepsius nei suoi capitoli, viceversa, sperimenta il restringimento del campo intenzionale delle cancellerie europee, che escludono dal possibile l'azione efficace."